,authors,ArticleTitle,journal_title,volume,date,pubmed,doi_pii_str,abstract
47,"GL. Schwartz and ST. Turner, ","""Pharmacogenetics of antihypertensive drug responses."", ",American journal of pharmacogenomics : genomics-related research in drug development and clinical practice ,4(3) ,(2004). ,15174896; ,,"The blood pressure (BP) response to any single antihypertensive drug is characterized by marked interindividual variation, and the known predictors of response are of limited value in identifying the optimum drug for an individual patient. Analysis of genetic variation has the potential to improve our understanding of determinants of antihypertensive drug response in order to individualize drug selection. Genetic variation can influence both pharmacokinetic and pharmacodynamic mechanisms underlying variation in drug response. Classic pharmacogenetic investigations have identified variations in single genes that have a large effect on antihypertensive drug metabolism and are inherited in a Mendelian fashion. These include a polymorphism in the CYP2D6 gene, encoding a cytochrome p450 family member involved in phase I drug metabolism, and polymorphisms in genes encoding enzymes involved in phase II drug metabolism, including N-acetyltransferase (NAT2), catechol-O-methyltransferase (COMT), and phenol sulfotransferase (P-PST, SULT1A1). Although these polymorphisms have major effects on the pharmacokinetic profiles of both commonly used antihypertensive drugs such as metoprolol (CYP2D6), and lesser used drugs such as hydralazine (NAT2), methyldopa (COMT), and minoxidil (SULT1A1), they have not been shown to influence variation in the antihypertensive effect of these drugs at conventional doses. Interest is now focused on identifying genetic polymorphisms that influence the pharmacodynamic determinants of antihypertensive response. Using a candidate gene approach, such polymorphisms have been identified in genes encoding alpha-adducin (ADD1), subunits of G-proteins (GNB3 and GNAS1), the beta(1)-adrenergic receptor (ADRB1), endothelial nitric oxide synthase (NOS3), and components of the renin-angiotensin-aldosterone system (angiotensinogen [AGT], angiotensin converting enzyme [ACE], the angiotensin type I receptor [AGTR1], and aldosterone synthase [CYP11B2]). These polymorphisms have been shown to influence the BP response to diuretics (ADD1, GNB3, NOS3, and ACE), beta-blockers (GNAS1 and ADRB1), ACE inhibitors (AGT, ACE, and AGTR1), angiotensin receptor blockers (ACE and CYP11B2), and clonidine (GNB3).An emerging consensus from these studies is that single gene effects on antihypertensive drug responses are small, and even the combined effects of all presently known polymorphisms do not account for enough variation in response to be clinically useful. New genome-wide scanning techniques may lead to the identification of genes previously unsuspected of influencing drug response. Additional requirements for pharmacogenetic approaches to become clinically useful are the characterization of the effects of haplotypes and multi-locus genotypes on drug response, and consideration of gene-by-environment interactions. Such studies will require huge sample sizes and novel statistical methods, but the theoretical and technical framework is in place to make this possible."
48,"M. Azimi-Nezhad, A. Teymoori and R. Ebrahimzadeh-Vesal, ","""Association of CYP11B2 gene polymorphism with preeclampsia in north east of Iran (Khorasan province)."", ",Gene ,733 ,(Apr. 2020). ,31935507; ,DOI 10.1016/j.gene.2020.144358.,"Identification the genetic factors in preeclampsia (PE) are useful to increase the current knowledge of the pathophysiology of the disorder. The genetic factors implicated for all cases of PE remain to be determined. This study was aimed to investigate association between ADD1 1378G > T, AGTR2 1675G > A, AGTR1 1166A > C, NOS3 894 G > T and CYP11B2 -344C > T gene polymorphisms in Iranian women with PE."
49,"H. Schelleman, OH. Klungel, JC. Witteman, MM. Breteler, A. Hofman, CM. van Duijn, A. de Boer and BH. Stricker, ","""Diuretic-gene interaction and the risk of myocardial infarction and stroke."", ",The pharmacogenomics journal ,7(5) ,(Oct. 2007). ,17189961; ,,"This study investigates whether the interaction between diuretics and alpha-adducin (ADD1) G460W or G-protein beta3-subunit (GNB3) rs2301339 polymorphism modifies the risk of myocardial infarction (MI) or stroke. Data were used from the Rotterdam Study. The drug-gene interaction was determined with a Cox proportional hazard model with adjustment for each drug class as time-dependent covariates. The risk of MI in current users of low-ceiling diuretics with one or two copies of the ADD1 W-allele (hazard ration (HR)=0.92) was similar compared to the expected joint effect of the W-allele and low-ceiling diuretics on a multiplicative scale (1.04 x 0.90=0.94) (synergy index (SI):0.99; 95% confidence interval (CI): 0.43-2.27). No drug-gene interaction was found on the risk of stroke (SI:0.66; 95% CI:0.43-1.27). In addition, a trend towards an interaction was found between current use and the GNB3 rs230119 G/A polymorphism on the risk of MI (SI: 0.51; 95% CI: 0.23-1.15), whereas no interaction on the risk of stroke was found (SI: 0.84; 95% CI: 0.46-1.56)."
50,"M. Yazdanpanah, FA. Sayed-Tabatabaei, A. Hofman, YS. Aulchenko, BA. Oostra, BH. Stricker, HA. Pols, SW. Lamberts, JC. Witteman, JA. Janssen and CM. van Duijn, ","""The alpha-adducin gene is associated with macrovascular complications and mortality in patients with type 2 diabetes."", ",Diabetes ,55(10) ,(Oct. 2006). ,17003363; ,,"We examined the association between alpha-adducin 1 (ADD1) gene polymorphism (Gly460Trp) with macrovascular complications and mortality in type 2 diabetes in a Caucasian population aged >or=55 years. The study was part of the Rotterdam Study, a prospective population-based cohort study. ADD1 polymorphism was determined in 6,471 participants, including 599 patients with type 2 diabetes at baseline. The prevalence of hypertension in type 2 diabetic patients was 2.57 times higher in ADD1 TT carriers compared with GG carriers (95% CI 1.05-6.32, P = 0.03). Homozygous T carriers also had a higher mean common carotid intima media thickness (IMT) compared with GG carriers (mean difference 0.05 mm, P for trend = 0.03). In diabetic patients with hypertension, the risk of mortality was 1.83 times higher in homozygous T carriers compared with the GG genotype group (95% CI 1.07-3.16, P = 0.03). The increased risk was only present among TT carriers who did not use antidiabetes medication (hazard ratio 2.18 [95% CI 1.12-4.24], P = 0.02). The results of this population-based cohort study suggest that the ADD1 gene contributes to the risk of hypertension and increases mean common carotid IMT in patients with type 2 diabetes. Furthermore, the study indicates that the ADD1 polymorphism could be useful in identifying hypertensive type 2 diabetic patients with a high risk of mortality."
51,"YV. Vakhitova, US. Kuzmina, MV. Voronin, LF. Zainullina and SB. Seredenin, ","""Effect of Fabomotizole on Brain Gene Expression in MR Rats in the Open Field Test."", ",Doklady. Biochemistry and biophysics ,488(1) ,(Sep. 2019). ,31768849; ,DOI 10.1134/S1607672919050090.,"Selective anxiolytic fabomotizole (Afobazol®) has affinity for the Sigma-1 chaperone receptor site, quinone reductase 2 (NQO2) and MAO-A regulatory sites, and melatonin receptor type 1 (MT1 receptor). The analysis of the effect of fabomotizole on the gene expression profile in the brain of MR (Maudsley Reactive) rats was carried out when modeling emotional stress in the open field test. A change in the expression of 14 genes was found, the results of the functional annotation of which showed that the mechanisms of action of fabomotizole may be associated with the regulation of translation of proteins (Rpl5, Rpl15, Ncl, and Ybx1), synaptic functions (Cplx2, Dlg4, Syngap1, Add1, Rab8b, Klc1, and Chn1), and cellular metabolism (Akr1d1, Bcat1, and Pkm)."
52,"MP. Duyao, SA. Taylor, AJ. Buckler, CM. Ambrose, C. Lin, N. Groot, D. Church, G. Barnes, JJ. Wasmuth and DE. Housman, ","""A gene from chromosome 4p16.3 with similarity to a superfamily of transporter proteins."", ",Human molecular genetics ,2(6) ,(Jun. 1993). ,8353488; ,,"We have previously used exon amplification to identify the ADD1 gene in cosmid Y24 from the Huntington's disease (HD) region of 4p16.3. The same technique has now yielded a second gene from this cosmid. This gene appears to encode a novel member of a superfamily of transporter proteins that includes active and passive transporters in a number of species. The predicted protein of 455 amino acids displays sequence similarity with the E. coli tetracycline resistance efflux protein encoded by cloning vector pBR322, and with a number of related transporters. This gene should open a route to isolating additional mammalian members of this growing superfamily."
53,"S. Choi, S. Jung, MK. Kim, J. Shin, MH. Shin, DH. Shin, YH. Lee, BY. Chun, KW. Hong and JY. Hwang, ","""Gene and dietary calcium interaction effects on brachial-ankle pulse wave velocity."", ","Clinical nutrition (Edinburgh, Scotland) ",35(5) ,(Oct. 2016). ,26387843; ,DOI 10.1016/j.clnu.2015.08.009.,Understanding the lifestyle and genetic factors that affect pulse wave velocity (PWV) may provide clues to preventing atherosclerotic cardiovascular events. The aim of this study is to investigate genome-wide genetic and dietary calcium (Ca) intake interaction effects on brachial-ankle pulse wave velocity (baPWV).
54,"C. Lanzani, L. Citterio, M. Jankaricova, MT. Sciarrone, C. Barlassina, S. Fattori, E. Messaggio, CD. Serio, L. Zagato, D. Cusi, JM. Hamlyn, A. Stella, G. Bianchi and P. Manunta, ","""Role of the adducin family genes in human essential hypertension."", ",Journal of hypertension ,23(3) ,(Mar. 2005). ,15716695; ,,"In both humans and rats, polymorphisms of the alpha adducin (ADD1) gene are involved in renal sodium handling, essential hypertension and some of its organ complications. Adducin functions within cells as a heterodimer composed of various combinations of three subunits that are coded by three genes (ADD1, 2, 3) each located on a different chromosome."
55,"M. Pravenec, P. Jansa, V. Kostka, V. Zídek, V. Kren, J. Forejt and TW. Kurtz, ","""Identification of a mutation in ADD1/SREBP-1 in the spontaneously hypertensive rat."", ",Mammalian genome : official journal of the International Mammalian Genome Society ,12(4) ,(Apr. 2001). ,11309661; ,,"It has recently been proposed that primary mutations in genes involved in fatty acid and lipid metabolism may contribute to the pathogenesis of insulin resistance and dyslipidemia often observed in spontaneous forms of hypertension. In the current study in the spontaneously hypertensive rat (SHR), we mapped and sequenced the gene encoding a key transcription factor known as ADD1 (adipocyte determination and differentiation factor 1) or SREBP-1c (sterol regulatory element binding protein- c) that has recently been identified as a master regulator of genes involved in the hepatic control of lipid and carbohydrate metabolism. We found that (1) the gene for ADD1/SREBP-1c maps to a region of rat Chromosome 10 previously reported to contain a quantitative trait locus involved in the regulation of hepatic cholesterol levels and (2) the SHR harbors a valine-to-methionine substitution in the COOH terminal portion of the ADD1/SREBP-1 protein that is not present in 44 other strains of laboratory rats. These findings, together with previous studies showing that transgenic expression of SREBP-1 isoforms has major effects on hepatic fatty acid and cholesterol biosynthesis, suggest that naturally occurring variation in the gene encoding the SREBP-1 isoforms might contribute to inherited variation in lipid metabolism in the SHR versus other strains of rats. These results should serve to motivate future transfection studies of the effect of the SHR mutant on SREBP-1 expression and activation in vitro, as well as the development of congenic and transgenic strains of SHR to investigate the effects of different variants of SREBP-1 on carbohydrate and lipid metabolism in vivo."
56,"S. Chen, H. Wang, X. Lu, DP. Liu, J. Chen, CE. Jaquish, DC. Rao, JE. Hixson, TN. Kelly, L. Hou, L. Wang, J. Huang, CS. Chen, TK. Rice, PK. Whelton, J. He and D. Gu, ","""Polymorphisms in the GNB3 and ADD1 genes and blood pressure in a Chinese population."", ",Human genetics ,128(2) ,(Aug. 2010). ,20473689; ,DOI 10.1007/s00439-010-0834-3.,"A large proportion of the phenotypic variation in blood pressure (BP) appears to be inherited as a polygenic trait. This study examined the association between 12 single nucleotide polymorphisms (SNPs) in the guanine nucleotide binding protein beta polypeptide 3 (GNB3) and adducin 1 alpha (ADD1) genes and systolic (SBP), diastolic (DBP), and mean arterial (MAP) BP. A total of 3,142 individuals from 636 families were recruited from rural north China, and 2,746 met the eligibility criteria for analysis. BP measurements were obtained using a random-zero sphygmomanometer. Genetic variants were determined using SNPlex assays on an automated DNA Sequencer. A mixed linear model was used to estimate the association between each SNP and BP level. After Bonferroni correction, marker rs4963516 of the GNB3 gene remained significantly associated with DBP (corrected P values = 0.006, 0.007 and 0.002 for co-dominant, additive, and recessive models, respectively) and MAP (corrected P values = 0.02, 0.049, and 0.005, respectively). Compared to carriers of the major A allele, CC homozygotes had higher mean DBP (75.81 +/- 0.62 vs. 73.46 +/- 0.25 mmHg, P = 0.0002) and MAP (91.87 +/- 0.68 vs. 89.42 +/- 0.28 mmHg, P = 0.0004) after adjusting for covariates of age, gender, BMI, study site, and room temperature during BP measurement. In summary, these data support a role for the GNB3 gene in BP regulation in the Chinese population. Future studies aimed at replicating these novel findings are warranted."
57,"JB. Kim, GD. Spotts, YD. Halvorsen, HM. Shih, T. Ellenberger, HC. Towle and BM. Spiegelman, ","""Dual DNA binding specificity of ADD1/SREBP1 controlled by a single amino acid in the basic helix-loop-helix domain."", ",Molecular and cellular biology ,15(5) ,(May. 1995). ,7739539; ,,"Adipocyte determination- and differentiation-dependent factor 1 (ADD1), a member of the basic helix-loop-helix (bHLH) family of transcription factors, has been associated with both adipocyte differentiation and cholesterol homeostasis (in which case it has been termed SREBP1). Using PCR-amplified binding analysis, we demonstrate that ADD1/SREBP1 has dual DNA sequence specificity, binding to both an E-box motif (ATCACGTGA) and a non-E-box sequence previously shown to be important in cholesterol metabolism, sterol regulatory element 1 (SRE-1; ATCACCCCAC). The ADD1/SREBP1 consensus E-box site is similar to a regulatory sequence designated the carbohydrate response element, defined by its ability to regulate transcription in response to carbohydrate in genes involved in fatty acid and triglyceride metabolism in liver and fat. When expressed in fibroblasts, ADD1/SREBP1 activates transcription through both the carbohydrate response E-box element and SRE-1. Substitution of an atypical tyrosine in the basic region of ADD1/SREBP1 to an arginine found in most bHLH protein causes a restriction to only E-box binding. Conversely, substitution of a tyrosine for the equivalent arginine in another bHLH protein, upstream stimulatory factor, allows this factor to acquire a dual binding specificity similar to that of ADD1/SREBP1. Promoter activation by ADD1/SREBP1 through the carbohydrate response element E box is not sensitive to the tyrosine-to-arginine mutation, while activation through SRE-1 is completely suppressed. These data illustrate that ADD1/SREBP1 has dual DNA sequence specificity controlled by a single amino acid residue; this dual specificity may provide a novel mechanism to coordinate different pathways of lipid metabolism."
58,"V. Syed, X. Zhang, KM. Lau, R. Cheng, K. Mukherjee and SM. Ho, ","""Profiling estrogen-regulated gene expression changes in normal and malignant human ovarian surface epithelial cells."", ",Oncogene ,24(55) ,(Dec. 2005). ,16116479; ,,"Estrogens regulate normal ovarian surface epithelium (OSE) cell functions but also affect epithelial ovarian cancer (OCa) development. Little is known about how estrogens play such opposing roles. Transcriptional profiling using a cDNA microarray containing 2400 named genes identified 155 genes whose expression was altered by estradiol-17beta (E2) in three immortalized normal human ovarian surface epithelial (HOSE) cell lines and 315 genes whose expression was affected by the hormone in three established OCa (OVCA) cell lines. All but 19 of the genes in these two sets were different. Among the 19 overlapping genes, five were found to show discordant responses between HOSE and OVCA cell lines. The five genes are those that encode clone 5.1 RNA-binding protein (RNPS1), erythrocyte adducin alpha subunit (ADD1), plexin A3 (PLXNA3 or the SEX gene), nuclear protein SkiP (SKIIP), and Rap-2 (rap-2). RNPS1, ADD1, rap-2, and SKIIP were upregulated by E2 in HOSE cells but downregulated by estrogen in OVCA cells, whereas PLXNA3 showed the reverse pattern of regulation. The estrogen effects was observed within 6-18 h of treatment. In silicon analyses revealed presence of estrogen response elements in the proximal promoters of all five genes. RNPS1, ADD1, and PLXNA3 were underexpressed in OVCA cell lines compared to HOSE cell lines, while the opposite was true for rap-2 and SKIIP. Functional studies showed that RNPS1 and ADD1 exerted multiple antitumor actions in OVCA cells, while PLXNA3 only inhibited cell invasiveness. In contrast, rap-2 was found to cause significant oncogenic effects in OVCA cells, while SKIIP promotes only anchorage-independent growth. In sum, gene profiling data reveal that (1) E2 exerts different actions on HOSE cells than on OVCA cells by affecting two distinct transcriptomes with few overlapping genes and (2) among the overlapping genes, a set of putative oncogenes/tumor suppressors have been identified due to their differential responses to E2 between the two cell types. These findings may explain the paradoxical roles of estrogens in regulating normal and malignant OSE cell functions."
59,"J. Auwerx, G. Martin, M. Guerre-Millo and B. Staels, ","""Transcription, adipocyte differentiation, and obesity."", ","Journal of molecular medicine (Berlin, Germany) ",74(7) ,(Jul. 1996). ,8841947; ,,"Differentiation of adipogenic precursor cells into mature adipocytes is a complex phenomenon, characterized by an ordered expression of adipocyte-specific genes, triggered by a set of interacting transcription factors. The most important transcription factors involved in this process are the gamma form of peroxisome proliferator activated receptors (PPAR gamma) and the various members of the CCAAT enhancer binding proteins (alpha, beta, and delta). In addition to PPAR gamma and these enhancer binding proteins, several other transcription factors, including ADD-1 (SRE-BP), HMGI-C, are involved in regulating this process. Altered activity and/or expression of these transcription factors, will induce the expression of target genes in the differentiating cells, ultimately resulting in the phenotypical characteristics of the adipocytes. It is speculated that modulation of these transcription factors by either pharmacological or dietary manipulations might influence adipocyte differentiation and prove beneficial in the prevention and treatment of obesity."
60,"L. Wang, B. Zheng, H. Zhao, P. Du, A. Sun, K. Hua and Y. Gao, ","""α-Adducin gene G614T polymorphisms in essential hypertension patients with high low density lipoprotein (LDL) levels."", ",The Indian journal of medical research ,139(2) ,(Feb. 2014). ,24718403; ,,The association between α-adducin gene G614T polymorphism and essential hypertension (EH) is not clear. The present study was carried out to examine a possible association between α-adducin gene G614T mutation and essential hypertension in Chinese population.
61,"P. Manunta, L. Citterio, C. Lanzani and M. Ferrandi, ","""Adducin polymorphisms and the treatment of hypertension."", ",Pharmacogenomics ,8(5) ,(May. 2007). ,17465710; ,,"Hypertension is an important public health problem affecting more than 50 million individuals in the USA alone. The most common form, essential hypertension, results from the complex interplay between genetic predisposition and environmental influences. Epidemiological, migration, intervention and genetic studies in humans and animals provide very strong evidence of a causal link between high salt intake and high blood pressure. One of the candidate genes for salt-sensitive hypertension is adducin. Adducin is a heterodimeric cytoskeleton protein, the three subunits of which are encoded by genes (ADD1, ADD2 and ADD3) that map to three different chromosomes. A long series of parallel studies in the Milan hypertensive rat strain model of hypertension and humans indicated that an altered adducin function might cause hypertension through enhanced constitutive tubular sodium reabsorption. An example of a prospective efficacy of pharmacogenetics and pharmacogenomics is the detection and impact of adducin polymorphisms on hypertension. In particular, the selective advantages of diuretics in preventing myocardial infarction and stroke over other antihypertensive therapies that produce a similar blood pressure reduction in carriers of the mutated adducin may support new strategies aimed at optimizing the use of new antihypertensive agents for the prevention of hypertension-associated organ damage."
62,"SM. Yuan, Y. Guo, Q. Wang, Y. Xu, M. Wang, HN. Chen and WM. Shen, ","""Over-expression of PPAR-γ2 gene enhances the adipogenic differentiation of hemangioma-derived mesenchymal stem cells in vitro and in vivo."", ",Oncotarget ,8(70) ,(Dec. 2017). ,29383203; ,DOI 10.18632/oncotarget.23705.,"Most of infantile hemangiomas involute into fibrofatty tissue in childhood, which indicates adipogenesis during this period. Mesenchymal stem cells (MSCs) contribute to the adipogenesis in IH. In this study, we investigated the effects of overexpression of PPAR-γ2 gene on the adipogenic differentiation of Hemangioma-derived MSCs (Hem-MSCs), and discussed the possibility of targeted therapy via PPAR-γ pathway."
63,"YL. Qu, CM. Wu, LX. Zhang, BL. Wen, X. Zhang, C. Ma, XY. Yan, HB. Cui, DM. Wang and YR. Ji, ","""Association between alpha-adducin gene rs4963 polymorphism and hypertension risk in Asian population: a meta-analysis."", ","Cellular and molecular biology (Noisy-le-Grand, France) ",62(13) ,(Nov. 2016). ,28040068; ,DOI 10.14715/cmb/2016.62.13.11.,"Some studies investigated the association between ADD1 rs4963 polymorphism and hypertension risk. However, the results remained inconclusive. Thus, we performed a meta-analysis. Published reports were searched in PubMed and Google Scholar. The strength of association was assessed by calculating odds ratios (OR) and 95% confidence interval (CI). Twelve studies with 5097 cases and 5937 controls were conducted in this study. Individuals with ADD1 rs4963 polymorphism showed an increased hypertension risk (OR = 1.21; 95%CI, 1.11-1.33; P &lt; 0.0001). Subgroup analyses were performed according to country and age. The results showed that Chinese with ADD1 rs4963 polymorphism showed an increased hypertension risk (OR = 1.28; 95%CI, 1.09-1.51; P = 0.003). However, subjects in Japan and India did not have increased hypertension risk. In the subgroup analysis by age, older subjects, but not younger subjects, with ADD1 rs4963 polymorphism showed an increased hypertension risk (OR = 1.19; 95%CI, 1.07-1.32; P = 0.001). In conclusion, this meta-analysis suggested that ADD1 rs4963 polymorphism might be associated with increased hypertension risk."
64,"M. Zakrzewski-Jakubiak, S. de Denus, MP. Dubé, F. Bélanger, M. White and J. Turgeon, ","""Ten renin-angiotensin system-related gene polymorphisms in maximally treated Canadian Caucasian patients with heart failure."", ",British journal of clinical pharmacology ,65(5) ,(May. 2008). ,18279468; ,DOI 10.1111/j.1365-2125.2007.03091.x.,The progression and pharmacological response of heart failure-affected patients are subject to interindividual variability. It is also acknowledged that the genotype frequency of certain gene polymorphisms varies across different ethnic groups and that a difference in gene polymorphism frequencies between healthy and heart failure patients seems to exist.
