,authors,ArticleTitle,journal_title,volume,date,pubmed,doi_pii_str,abstract
65,"IA. Deckers, PA. van den Brandt, M. van Engeland, FJ. van Schooten, RW. Godschalk, AP. Keszei, JG. Hogervorst and LJ. Schouten, ","""Potential role of gene-environment interactions in ion transport mechanisms in the etiology of renal cell cancer."", ",Scientific reports ,6 ,(Sep. 2016). ,27686058; ,DOI 10.1038/srep34262.,"We investigated the ion transport mechanism (ITM) in renal cell cancer (RCC) etiology using gene-environment interactions between candidate single nucleotide polymorphisms (SNPs) and associated environmental factors, including dietary intakes of sodium, potassium and fluid, hypertension and diuretic medication. A literature-based selection of 13 SNPs in ten ITM genes were successfully genotyped in toenail DNA of 3,048 subcohort members and 419 RCC cases from the Netherlands Cohort Study. Diet and lifestyle were measured with baseline questionnaires. Cox regression analyses were conducted for main effects and gene-environment interactions. ADD1_rs4961 was significantly associated with RCC risk, showing a Hazard Ratio (HR) of 1.24 (95% confidence intervals (CI): 1.01-1.53) for the GT + TT (versus GG) genotype. Four of 65 tested gene-environment interactions were statistically significant. Three of these interactions clustered in SLC9A3_rs4957061, including the ones with fluid and potassium intake, and diuretic medication. For fluid intake, the RCC risk was significantly lower for high versus low intake in participants with the CC genotype (HR(95% CI): 0.47(0.26-0.86)), but not for the CT + TT genotype (P-interaction = 0.002). None of the main genetic effects and gene-environment interactions remained significant after adjustment for multiple testing. Data do not support the general hypothesis that the ITM is a disease mechanism in RCC etiology."
66,"J. Kalita, UK. Misra, IS. Bindu, B. Kumar and B. Mittal, ","""Angiotensin-converting enzyme (rs4646994) and α ADDUCIN (rs4961) gene polymorphisms' study in primary spontaneous intracerebral hemorrhage."", ",Neurology India ,59(1) ,(2011). ,21339657; ,DOI 10.4103/0028-3886.76856.,Primary spontaneous intracerebral hemorrhage (PSICH) is common in Asia and may have a genetic basis.
67,"VM. Salinas-Torres, RA. Salinas-Torres, RM. Cerda-Flores and LE. Martínez-de-Villarreal, ","""Genetic variants conferring susceptibility to gastroschisis: a phenomenon restricted to the interaction with the environment?,"" ",Pediatric surgery international ,34(5) ,(May. 2018). ,29550988; ,DOI 10.1007/s00383-018-4247-z.,"Genes involved in gastroschisis have shown a strong interaction with environmental factors. However, less is known about its influence. We aimed to systematically review the genetic associations of gastroschisis, to summarize whether its genetic susceptibility has been restricted to the interaction with the environment, and to identify significant gaps that remain for consideration in future studies."
68,"S. Friso, CA. Carvajal, CE. Fardella and O. Olivieri, ","""Epigenetics and arterial hypertension: the challenge of emerging evidence."", ",Translational research : the journal of laboratory and clinical medicine ,165(1) ,(Jan. 2015). ,25035152; ,DOI 10.1016/j.trsl.2014.06.007.,"Epigenetic phenomena include DNA methylation, post-translational histone modifications, and noncoding RNAs, as major marks. Although similar to genetic features of DNA for their heritability, epigenetic mechanisms differ for their potential reversibility by environmental and nutritional factors, which make them potentially crucial for their role in complex and multifactorial diseases. The function of these mechanisms is indeed gaining interest in relation to arterial hypertension (AH) with emerging evidence from cell culture and animal models as well as human studies showing that epigenetic modifications have major functions within pathways related to AH. Among epigenetic marks, the role of DNA methylation is mostly highlighted given the primary role of this epigenetic feature in mammalian cells. A lower global methylation was observed in DNA of peripheral blood mononuclear cells of hypertensive patients. Moreover, DNA hydroxymethylation appears modifiable by salt intake in a Dahl salt-sensitive rat model. The specific function of DNA methylation in regulating the expression of AH-related genes at promoter site was described for hydroxysteroid (11-beta) dehydrogenase 2 (HSD11B2), somatic angiotensin converting enzyme (sACE), Na+/K+/2Cl- cotransporter 1 (NKCC1), angiotensinogen (AGT), α-adducin (ADD1), and for other crucial genes in endocrine hypertension. Post-translational histone methylation at different histone 3 lysine residues was also observed to control the expression of genes related to AH as lysine-specific demethylase-1(LSD1), HSD11B2, and epithelial sodium channel subunit α (SCNN1A). Noncoding RNAs including several microRNAs influence genes involved in steroidogenesis and the renin-angiotensin-aldosterone pathway. In the present review, the current knowledge on the relationship between the main epigenetic marks and AH will be presented, considering the challenge of epigenetic patterns being modifiable by environmental factors that may lead toward novel implications in AH preventive and therapeutic strategies."
69,"KM. Kiang and GK. Leung, ","""A Review on Adducin from Functional to Pathological Mechanisms: Future Direction in Cancer."", ",BioMed research international ,2018 ,(2018). ,29862265; ,DOI 10.1155/2018/3465929.,"Adducin (ADD) is a family of membrane skeleton proteins including ADD1, ADD2, and ADD3 that are encoded by distinct genes on different chromosomes. Adducin is primarily responsible for the assembly of spectrin-actin network that provides physical support to the plasma membrane and mediates signal transduction in various cellular physiological processes upon regulation by protein kinase C-dependent and calcium/calmodulin-dependent pathways. Abnormal phosphorylation, genetic variations, and alternative splicing of adducin may contribute to alterations in cellular functions involved in pathogenic processes. These alterations are associated with a wide range of diseases including cancer. This paper begins with a discussion on how adducin partakes in the structural formation of membrane skeleton, its regulation, and related functional characteristics, followed by a review on the pathogenesis of hypertension, biliary atresia, and cancer with respect to increased disease susceptibility mediated by adducin polymorphism and/or dysregulation. Given the functional diversity of adducin in different cellular compartments, we aim to provide a knowledge base whereby its pathophysiological roles can be better understood. More importantly, we aim to provide novel insights that may be of significance in turning the adducin model to clinical application."
70,"AC. Morrison, MS. Bray, AR. Folsom and E. Boerwinkle, ","""ADD1 460W allele associated with cardiovascular disease in hypertensive individuals."", ","Hypertension (Dallas, Tex. : 1979) ",39(6) ,(Jun. 2002). ,12052841; ,,"High blood pressure is a predictor of cardiovascular disease. Hence, genes contributing to essential hypertension may play a role in the etiology of cardiovascular disease. For this reason, we examined the association between the alpha-adducin (ADD1) G460W and G-protein beta3 subunit (GNB3) 825C>T polymorphisms and the prevalence of peripheral arterial disease (PAD) and incidence of coronary heart disease (CHD) in non-Hispanic whites from the Atherosclerosis Risk in Communities (ARIC) Study. PAD prevalence was defined by an ankle-brachial index, ie, the ratio of ankle systolic blood pressure to brachial artery systolic blood pressure, of </=0.90 for men and </=0.85 for women. CHD incidence was determined by following the ARIC cohort for a median of 5.3 years for potential coronary events. Stratified random samples of the ARIC cohort (n=703 and n=684) were used, respectively, as the comparison groups for the PAD (n=144) and incident CHD (n=408) cases. The GNB3 825T allele and the ADD1 460W allele were not significantly associated with prevalence of PAD or incidence of CHD. However, a test of the interaction between hypertension status and the ADD1 G460W polymorphism indicated that further evaluation of the ADD1 polymorphism in only hypertensive individuals was warranted. The ADD1 460W allele was significantly associated with PAD (odds ratio [OR]: 2.61, 95% CI, 1.27-5.37, P=0.01) and CHD (hazard rate ratio [HRR]: 2.30, 95% CI, 1.20-4.42, P=0.01) in hypertensive individuals after adjustment for multiple cardiovascular disease risk factors. An interaction with hypertension in the association between the ADD1 G460W polymorphism and cardiovascular disease merits further testing in additional populations."
71,"G. Bianchi, P. Ferrari and JA. Staessen, ","""Adducin polymorphism: detection and impact on hypertension and related disorders."", ","Hypertension (Dallas, Tex. : 1979) ",45(3) ,(Mar. 2005). ,15699449; ,,"Adducin is a heterodymeric cytoskeleton protein, the 3 subunits of which are encoded by genes (ADD1, ADD2, ADD3) mapping to 3 different chromosomes. A long series of parallel studies in the Milan hypertensive rat strain model of hypertension and humans indicated that an altered adducin function may cause hypertension through an enhanced constitutive tubular sodium reabsorption. Six human linkage studies showed positive results when a DNA marker mapping to 30 kb from the ADD1 locus or single-nucleotide polymorphisms (SNPs) of 1 of the 3 adducin genes were considered either alone or in combination with each other or angiotensin-converting enzyme (ACE) D allele or salt intake. When DNA markers mapping at much larger distance from the ADD1 locus were used, negative results were found by 4 studies. Positive results were also obtained in 18 of 20 association studies that, in addition to blood pressure, investigated variables reflecting body sodium or the renin-angiotensin system. Mixed results regarded case-control studies or studies in predominantly normotensive populations that did not consider the above-mentioned variables. Four of 5 studies showed a selective beneficial effect of diuretics in carriers of the mutated ADD1. Twelve of 16 studies found that ADD1 polymorphism alone or in combination with that of ACE positively associates with stroke or coronary heart disease or renal or vascular dysfunctions. In conclusion, when context is taken into account, the impact of adducin in hypertension and its related disorders is clear."
72,"Z. Yu, J. Liu, S. Guo, C. Xing, X. Fan, M. Ning, JC. Yuan, EH. Lo and X. Wang, ","""Neuroglobin-overexpression alters hypoxic response gene expression in primary neuron culture following oxygen glucose deprivation."", ",Neuroscience ,162(2) ,(Aug. 2009). ,19401220; ,DOI 10.1016/j.neuroscience.2009.04.055.,"Neuroglobin (Ngb) is a tissue globin specifically expressed in neurons. Our laboratory and others have shown that Ngb overexpression protects neurons against hypoxia/ischemia, but the underlying mechanisms remain poorly understood. Recent studies demonstrate that hypoxia/ischemia induces a multitude of spatially and temporally regulated responses in gene expression, and initial evidence suggested that Ngb might function in altering biological processes of gene expression. In this study, we asked how Ngb may help regulate genes responsive to hypoxia. Expression of hypoxic response genes following oxygen-glucose deprivation (OGD) was examined using mRNA arrays in neuroglobin-overexpressing transgenic (Ngb-Tg) and wild type (WT) mouse neurons. From a total of 113 genes on the microarray, mRNA expression of 65 genes was detected. Under rest condition, 14 genes were downregulated in Ngb-Tg neurons compared to WT. In WT neurons, after 4-h OGD followed by 4-h reoxygenation (O4/R4), 20 genes were significantly downregulated, and only Fos mRNA was significantly increased. However, out of the 20 downregulated genes in WT neurons, 12 of them were no longer significantly changed in Ngb-Tg neurons: Add1, Arnt2, Camk2g, Cstb, Dr1, Epas1, Gna11, Hif1a, Il6st, Khsrp, Mars and Rara. Among these 12 genes, 8 (Add1, Camk2g, Cstb, Dr1, Epas1, Gna11, Hif1a, Khsrp) were already reduced in Ngb-Tg neurons compared to WT under rest conditions. Additionally, three genes that initially showed no changes in WT neurons (Ctgf, Egfr and Pea15) were downregulated after OGD in the Ngb-Tg neurons. These findings suggest that Ngb overexpression modulates mRNA expression of multiple hypoxic response genes in the early phase after OGD/reoxygenation. Further studies on these gene networks and interactions may lead to better understanding of Ngb in signaling pathways that contribute to neuroprotection."
73,"F. Safian, M. Bayat, V. Jajarmi, MA. Abdollahifar, H. Nazarian, ZS. Mofarahe, MG. Novin, M. Kazemi, P. Raee, S. Chien and MG. Novin, ","""Comparative Effect of Photobiomodulation on Human Semen Samples Pre- and Post-Cryopreservation."", ","Reproductive sciences (Thousand Oaks, Calif.) ",29(5) ,(May. 2022). ,35277845; ,DOI 10.1007/s43032-021-00805-x.,"The primary objective of this study is to evaluate and to compare the effects of photobiomodulation (PBM) on sperm parameters both before and after cryopreservation. In this regard, 24 freshly ejaculated semen samples from normozoospermic men were included in this study. Each semen sample was randomly divided into three groups (1 ml aliquot for each group): the control group (group one) underwent conventional sperm cryopreservation (n = 24), group two underwent pre-freezing PBM exposure (810 nm, diode laser, and 0.6 J/cm2) (n = 24), and group three underwent post freezing and thawing PBM exposure (n = 24). Indicators of sperm quality, including total sperm motility (TSM), progressive sperm motility (PSM), DNA fragmentation, lipid peroxidation levels, apoptosis-like changes, and gene expression levels of protamine (PRM) 1, PRM2, and adducin 1 alpha (ADD1), were investigated in a blinded style. Due to the beneficial effect of pre-freezing PBM therapy, group 2 exhibited the highest TSM and PSM levels compared to groups 1 and 3. At the same time, DNA fragmentation and lipid peroxidation were significantly reduced in the group 2 compared to the group 1 (p = 0.024 p = 0.016, respectively). Evaluation of apoptotic/necrotic changes revealed that parameters including early apoptosis, dead, and necrotic cells decreased in the group 2 compared to the either groups 1 (p = 0. 008, p = 0. 032, p = 0. 02, respectively) or group 3 (p = 0.037, p = 0.108, p = 0.083). There were no significant differences in the expression levels of PRM1, PRM2, and ADD1 among the study groups. Based on our results, PBM therapy prior to cryopreservation, even in the normal semen samples, plays a significant protective role against cryo-damage by preserving the functional parameters of spermatozoa."
74,"CL. Li, YC. Pan, H. Meng, ZL. Wang and XG. Huang, ","""Distributions of polymorphism of ADD1, MC4R, H-FABP gene, associated with IMF and BF in 3 populations in pig."", ",Yi chuan = Hereditas ,28(2) ,(Feb. 2006). ,16520310; ,,"Different breeds of pigs varied in traits of meat quality, especially between local abroad varieties. Intramuscular fat content (IMF) and back fat thickness (BF) have extra difference between Chinese breeds and foreign breeds. We have known that polymorphism of H-FABP, MC4R and ADD1 gene associated relation with IMF or BF in recent research. The Meishan, Sutai and Duroc x Landrace x Yorkshair become experimental animal in this research. Result show three breeds have different IMF and BF because different distributions of polymorphism three genes. Meishan has particular genetic background, so it should be protected. The results of associated analysis show that the polymorphism of three genes was associated traits of IMF and BF, polymorphism of MC4R gene was not associated traits BF. The molecular marker can apply to pig breeding by molecular marker-assisted selection (MAS)."
75,"S. Miard and L. Fajas, ","""Atypical transcriptional regulators and cofactors of PPARgamma."", ",International journal of obesity (2005) ,29 Suppl 1 ,(Mar. 2005). ,15711575; ,,"Regulation of peroxisome proliferator-activated receptor gamma (PPARgamma) activity is the result of several events. The first control level is the regulation of the expression of PPARgamma. Examples of this regulation, during adipogenesis, is the transactivation of the PPARgamma promoter by transcription factors of the classical pathway, such as C/EBPs or ADD1/SREBP1, but also newly identified factors, such as E2Fs. When preadipocytes re-enter the cell cycle, PPARgamma expression is induced coincident with an increase in DNA synthesis, suggesting the involvement of the E2F family of cell cycle regulators. E2F1 induces PPARgamma transcription during clonal expansion, whereas E2F4 represses PPARgamma expression during terminal adipocyte differentiation. Hence, E2Fs represent the link between proliferative signaling pathways, triggering clonal expansion, and terminal adipocyte differentiation through regulation of PPARgamma expression. A second regulatory level of PPARgamma action is interaction with cofactors. We will focus our attention on the atypical PPARgamma modulators. We have described an interaction between PPARgamma and the retinoblastoma protein, RB, which is both dependent upon ligand binding by PPARgamma and upon the phosphorylation status of RB. The interaction between PPARgamma and RB decreases the transcriptional activity of PPARgamma through recruitment of the histone deacetylase HDAC3. Inhibition of HDAC activity consequently results in a strong activation of PPARgamma."
76,"WH. Hsu, WJ. Wang, WY. Lin, YM. Huang, CC. Lai, JC. Liao and HC. Chen, ","""Adducin-1 is essential for spindle pole integrity through its interaction with TPX2."", ",EMBO reports ,19(8) ,(Aug. 2018). ,29925526; ,DOI 10.15252/embr.201745607.,"Bipolar spindle assembly is necessary to ensure the proper progression of cell division. Loss of spindle pole integrity leads to multipolar spindles and aberrant chromosomal segregation. However, the mechanism underlying the maintenance of spindle pole integrity remains unclear. In this study, we show that the actin-binding protein adducin-1 (ADD1) is phosphorylated at S726 during mitosis. S726-phosphorylated ADD1 localizes to centrosomes, wherein it organizes into a rosette-like structure at the pericentriolar material. ADD1 depletion causes centriole splitting and therefore results in multipolar spindles during mitosis, which can be restored by re-expression of ADD1 and the phosphomimetic S726D mutant but not by the S726A mutant. Moreover, the phosphorylation of ADD1 at S726 is crucial for its interaction with TPX2, which is essential for spindle pole integrity. Together, our findings unveil a novel function of ADD1 in maintaining spindle pole integrity through its interaction with TPX2."
77,"JH. Kim, JN. Lee and YK. Paik, ","""Cholesterol biosynthesis from lanosterol. A concerted role for Sp1 and NF-Y-binding sites for sterol-mediated regulation of rat 7-dehydrocholesterol reductase gene expression."", ",The Journal of biological chemistry ,276(21) ,(May. 2001). ,11279217; ,,"The 7-dehydrocholesterol reductase (Dhcr7) is the terminal enzyme in the pathway of cholesterol biosynthesis. We have previously reported that sterol depletion in vivo caused a significant induction of both liver mRNA and enzyme activity of Dhcr7 (Bae, S.-H., Lee, J. N., Fitzky, B. U., Seong, J., and Paik, Y.-K. (1999) J. Biol. Chem. 274, 14624-14631). In this paper, we also observed liver cell-specific sterol-mediated Dhcr7 gene induction in vitro by sterol depletion in rat hepatoma cells, suggesting the presence of sterol-mediated regulatory elements in the Dhcr7 gene. To understand the mechanisms responsible for regulating Dhcr7 expression, we have isolated the 5'-flanking region of the gene encoding rat Dhcr7 and have characterized the potential regulatory elements of the gene that are responsible for sterol-mediated regulation. The Dhcr7 promoter contains binding sites for Sp1 (at -177, -172, -125, and -20), NF-Y (at -88 and -51), and SREBP-1 or ADD1 (at -33). Deletion analysis of the Dhcr7 gene promoter (-1053/+31), employing a nested series of Dhcr7-luciferase constructs, demonstrated that the -179 upstream region of the gene is necessary and sufficient for optimal efficient sterol-regulated transcription. DNase I footprinting and electrophoretic mobility shift assay showed that the SRE1/E box (-33/-22) involved in sterol response of many sterol-related enzyme genes was protected specifically by the overexpressed recombinant ADD1. Mutational analysis for the functional relationship between the identified cis-elements in this region indicate that one of the binding sites for Sp1 (GC box at -125) and NF-Y (CCAAT box at -88) plays a cooperative role in the sterol-mediated activation, in which the latter site also acts as a co-regulator for SREBP-activated Dhcr7 promoter activity. We believe that Dhcr7 is the first enzyme characterized with a sterol-regulatory function in the post-lanosterol pathway. This may be important for understanding the coordinated control of cholesterol biosynthesis as well as the molecular mechanism of Smith-Lemli-Opitz syndrome-related protein in mammals."
78,"X. Feng, X. Liu, X. Cai, T. Lin, W. Xu, C. Yang, Y. Liu, S. Yang and D. Fu, ","""The Influence of Tetracycline Inducible Targeting Rat PPARγ Gene Silencing on the Osteogenic and Adipogenic Differentiation of Bone Marrow Stromal Cells."", ",Current pharmaceutical design ,22(41) ,(2016). ,27396594; ,DOI 10.2174/1381612822666160708223353.,"Peroxisome proliferator-activated receptor γ (PPARγ) has been considered as the master regulator for adipogenesis of bone marrow stromal cells (BMSCs). However, there are few reports regarding the effect of PPARγ gene silencing on osteogenic and adipogenic differentiation in rat BMSCs, and no reports about tissue targeting and conditional knockdown of PPARγ gene. In this study, we construct rat PPARγ gene shRNA Tet-on lentiviral vector, the lentiviral vector facilitated tetracycline (which has the characteristics of bone targeting)-inducible knockdown specific to PPARγ gene, and transfect it into BMSCs, the silencing effects induced by tetracycline is significant. The expression of the adipogenic factors adipocyte determination and differentiation-dependent factor 1 (ADD1) and recombinant CCAAT/enhancer binding protein alpha (C/EBPα) were decreased as measured by RT-PCR and Western blot assay following PPARγ silencing. In contrast, expression of the osteogenic genes encoding collagen I and Cbfa1/Runx2 were increased. In adipogenic medium, PPARγ-shRNA transfection reduced the lipid droplet count as measured by Oil red O staining when compared to the control groups. In osteogenic medium, PPARγ-shRNA increased the activity of alkaline phosphatase and the amount of calcium deposition as measured by Alizarin red S staining. These results suggest that the rat PPARγ gene shRNA Teton lentiviral vector decreases adipogenic differentiation and promotes osteogenic differentiation in BMSCs induced by tetracycline."
79,"J. Ribot, M. Rantala, YA. Kesäniemi, A. Palou and MJ. Savolainen, ","""Weight loss reduces expression of SREBP1c/ADD1 and PPARgamma2 in adipose tissue of obese women."", ",Pflugers Archiv : European journal of physiology ,441(4) ,(Jan. 2001). ,11212213; ,,"Weight loss in obese patients, even if moderate, is clearly beneficial for health and implies a reduction in either adipocyte number or volume. This can be regulated by the key adipose transcription factors, sterol-regulatory-element binding protein-1c/adipocyte differentiation and determination factor-1 (SREBP1c/ADD1), peroxisome proliferator-activated receptor-gamma2 (PPARgamma2) and CCAAT-enhancer binding protein-alpha (C/EBPalpha). which regulate the adipocyte metabolism and differentiation process. The present study was undertaken to obtain insights into the expression of these transcription factors during moderate weight loss in humans. In addition, the adipose depot-related differences and the relation to adipose lipoprotein lipase (LPL) expression and plasma lipids were studied. Using quantitative reverse transcription polymerase chain reaction (RT-PCR), the total amount of each adipose transcription factor messenger ribonucleic acid (mRNA) was determined in the subcutaneous or omental adipose tissue after a controlled, 2-month, bodyweight-reduction trial in 11 obese middle-aged women and 17 comparable obese controls. Weight loss (6% of body weight) was associated with reduced serum insulin and plasma triacylglycerols. Adipose tissue PPARgamma2 and SREBP1c/ADD1 mRNA were lower in the weight-loss group than in controls (by 30% and 28%, respectively), whereas the C/EBPalpha mRNA level did not change. Moreover, PPARgamma2 mRNA was lower only in the subcutaneous adipose depot and was related to both adipose tissue lipoprotein lipase (LPL) mRNA and improvement in plasma triacylglycerols in the weight-loss group. Our results suggest a functional role for SREBP1c/ADD1 and PPARgamma2 in the control of energy metabolism in human adipose tissue."
