,authors,ArticleTitle,journal_title,volume,date,pubmed,doi_pii_str,abstract
35,"M. Moldes, M. Boizard, XL. Liepvre, B. Fève, I. Dugail and J. Pairault, ","""Functional antagonism between inhibitor of DNA binding (Id) and adipocyte determination and differentiation factor 1/sterol regulatory element-binding protein-1c (ADD1/SREBP-1c) trans-factors for the regulation of fatty acid synthase promoter in adipocytes."", ",The Biochemical journal ,344 Pt 3(Pt 3) ,(Dec. 1999). ,10585876; ,,"We show that Id (inhibitor of DNA binding) 2 and Id3, dominant negative members of the helix-loop-helix (HLH) family, interact with the adipocyte determination and differentiation factor 1 (ADD1)/sterol regulatory element-binding protein (SREBP) 1c, a transcription factor of the basic HLH-leucine zipper family that controls the expression of several key genes of adipose metabolism. Gel mobility-shift assays performed with in vitro-translated ADD1, Id2 or Id3 proteins and a fatty acid synthase (FAS) promoter oligonucleotide showed evidence for a marked inhibition of the formation of DNA-ADD1 complexes by Id2 or Id3 proteins. Co-immunoprecipitation studies using in vitro-translated proteins demonstrated further the physical interaction of Id and ADD1/SREBP-1c proteins in the absence of DNA. Using the FAS gene as a model of an ADD1-regulated promoter in transiently transfected isolated rat adipocytes or mature 3T3-L1 adipocytes, a potent inhibition of the activity of the FAS-chloramphenicol acetyltransferase reporter gene was observed by overexpression of Id2 or Id3. Reciprocally, co-transfection of Id3 antisense and ADD1 expression vectors in preadipocytes potentiated the ADD1/SREBP-1c effect on the FAS promoter activity. Finally, in the non adipogenic NIH-3T3 cell line, most of the ADD1-mediated trans-activation of the FAS promoter was counteracted by co-transfection of Id2 or Id3 expression vectors. Previous studies have indicated Id gene expression to be down-regulated during adipogenesis [Moldes, Lasnier, Fève, Pairault and Djian (1997) Mol. Cell. Biol. 17, 1796-1804]. We here demonstrated that there was a dramatic rise of Id2 and Id3 mRNA levels when 3T3-L1 adipocytes or isolated rat fat cells were exposed to lipolytic and anti-lipogenic agents, forskolin and isoproterenol. Taken together, our data show that Id products are functionally involved in modulating ADD1/SREBP-1c transcriptional activity, and thus lipogenesis in adipocytes."
36,"L. Holmes, A. Lim, CR. Comeaux, KW. Dabney and O. Okundaye, ","""DNA Methylation of Candidate Genes (ACE II, IFN-γ, AGTR 1, CKG, ADD1, SCNN1B and TLR2) in Essential Hypertension: A Systematic Review and Quantitative Evidence Synthesis."", ",International journal of environmental research and public health ,16(23) ,(Dec. 2019). ,31805646; ,DOI 10.3390/ijerph16234829.,"Physical, chemical, and social environments adversely affect the molecular process and results in cell signal transduction and the subsequent transcription factor dysregulation, leading to impaired gene expression and abnormal protein synthesis. Stressful environments such as social adversity, isolation, sustained social threats, physical inactivity, and highly methylated diets predispose individuals to molecular level alterations such as aberrant epigenomic modulations that affect homeostasis and hemodynamics. With cardiovascular disease as the leading cause of mortality in the US and blacks/African Americans being disproportionately affected by hypertension (HTN) which contributes substantially to these deaths, reflecting the excess mortality and survival disadvantage of this sub-population relative to whites, understanding the molecular events, including epigenomic and socio-epigenomic modulations, is relevant to narrowing the black-white mortality risk differences. We aimed to synthesize epigenomic findings in HTN namely (a) angiotensin-converting enzyme 2 (ACE II) gene, (b) Toll-like receptor 2 (TLR2) gene, (c) interferon γ (IFN-γ) gene, and (d) Capping Actin Protein, Gelosin-Like (CAPG) gene, adducin 1(ADD1) gene, (e) Tissue inhibitor of metalloproteinase 3 (TIMP3), (f) mesoderm specific transcript (MEST) loci, (g) sodium channel epithelial 1 alpha subunit 2 (SCNN1B), (h) glucokinase (CKG) gene (i) angiotensin II receptor, type1 (AGTR1), and DNA methylation (mDNA). A systematic review and quantitative evidence synthesis (QES) was conducted using Google Scholar and PubMed with relevant search terms. Data were extracted from studies on: (a) Epigenomic modulations in HTN based on ACE II (b) TLR2, (c) IFN-γ gene, (d) CAPG, ADD1, TIMP3, MEST loci, and mDNA. The random-effect meta-analysis method was used for a pooled estimate of the common effect size, while z statistic and I^2 were used for the homogeneity of the common effect size and between studies on heterogeneity respectively. Of the 642 studies identified, five examined hypermethylation while seven studies assessed hypomethylation in association with HTN. The hypermethylation of ACE II, SCNN1B, CKG, IFN-γ gene, and miR-510 promoter were associated with hypertension, the common effect size (CES) = 6.0%, 95% CI, -0.002-11.26. In addition, the hypomethylation of TLR2, IFN-γ gene, ADD1, AGTR1, and GCK correlated with hypertension, the CES = 2.3%, 95% CI, -2.51-7.07. The aberrant epigenomic modulation of ACE II, TLR2, IFN-γ, AGTR1, and GCK correlated with essential HTN. Transforming the environments resulting from these epigenomic lesions will facilitate early intervention mapping in reducing HTN in the US population, especially among socially disadvantaged individuals, particularly racial/ethnic minorities."
37,"JX. Cui, W. Chen and YQ. Zeng, ","""Development of FQ-PCR method to determine the level of ADD1 expression in fatty and lean pigs."", ",Genetics and molecular research : GMR ,14(4) ,(Oct. 2015). ,26535708; ,DOI 10.4238/2015.October.29.13.,"To determine how adipocyte determination and differentiation factor 1 (ADD1), a gene involved in the determination of pork quality, is regulated in Laiwu and Large pigs, we used TaqMan fluorescence quantitative real-time polymerase chain reaction (FQ-PCR) to detect differential expression in the longissimus muscle of Laiwu (fatty) and Large White (lean) pigs. In this study, the ADD1 and GAPDH cDNA sequences were cloned using a T-A cloning assay, and the clone sequences were consistent with those deposited in GenBank. Thus, the target fragment was successfully recombined into the vector, and its integrity was maintained. The standard curve and regression equation were established through the optimized FQ-PCR protocol. The standard curve of porcine ADD1 and GAPDH cDNA was determined, and its linear range extension could reach seven orders of magnitudes. The results showed that this method was used to quantify ADD1 expression in the longissimus muscle of two breeds of pig, and was found to be accurate, sensitive, and convenient. These results provide information regarding porcine ADD1 mRNA expression and the mechanism of adipocyte differentiation, and this study could help in the effort to meet the demands of consumers interested in the maintenance of health and prevention of obesity. Furthermore, it could lead to new approaches in the prevention and clinical treatment of this disease."
38,"L. Wang, S. Chen, Q. Zhao, JE. Hixson, DC. Rao, CE. Jaquish, J. Huang, X. Lu, J. Chen, J. Cao, J. Li, H. Li, J. He, DP. Liu and D. Gu, ","""Association between genetic variants of the ADD1 and GNB3 genes and blood pressure response to the cold pressor test in a Chinese Han population: the GenSalt Study."", ",Hypertension research : official journal of the Japanese Society of Hypertension ,35(8) ,(Aug. 2012). ,22476228; ,DOI 10.1038/hr.2012.38.,"Genetic factors influence blood pressure (BP) response to the cold pressor test (CPT), which is a phenotype related to hypertension risk. We examined the association between variants of the α-adducin (ADD1) and guanine nucleotide binding protein (G protein) β-polypeptide 3 (GNB3) genes and BP response to the CPT. A total of 1998 Han Chinese participants from the Genetic Epidemiology Network of Salt Sensitivity completed the CPT. The area under the curve (AUC) above the baseline BP during the CPT was used to measure the BP response. Twelve single-nucleotide polymorphisms (SNPs) of the ADD1 and GNB3 genes were selected and genotyped. Both single-marker and haplotype association analyses were conducted using linear mixed models. The rs17833172 and rs3775067 SNPs of the ADD1 gene and the rs4963516 SNP of the GNB3 gene were significantly associated with the BP response to CPT, even after adjusting for multiple testing. For the ADD1 gene, the AA genotype of SNP rs17833172 was associated with lower systolic BP (SBP) reactivity (P<0.0001) and faster BP recovery (P=0.0003). The TT genotype of rs3775067 was associated with slower SBP recovery (P=0.004). For the GNB3 gene, the C allele of SNP rs4963516 was associated with faster diastolic BP recovery (P=0.002) and smaller overall AUC (P=0.003). Haplotype analysis indicated that the CCGC haplotype of ADD1 constructed by rs1263359, rs3775067, rs4961 and rs4963 was significantly associated with the BP response to CPT. These data suggest that genetic variants of the ADD1 and GNB3 genes may have important roles in BP response to the CPT. Future studies aimed at replicating these novel findings are warranted."
39,"HK. Rho, J. Park, JH. Suh and JB. Kim, ","""Transcriptional regulation of mouse 6-phosphogluconate dehydrogenase by ADD1/SREBP1c."", ",Biochemical and biophysical research communications ,332(1) ,(Jun. 2005). ,15896329; ,,"6-Phosphogluconate dehydrogenase (6PGDH) constitutes the pentose phosphate pathway and produces NADPH. 6PGDH is also considered as a lipogenic gene since NADPH is a pivotal cofactor for lipogenesis. Thus, it is important to elucidate how 6PGDH is regulated by various signals related to energy homeostasis. Here, we provide several evidences that ADD1/SREBP1c regulates the expression of mouse 6PGDH gene. DNase I footprinting assay and point mutation studies revealed that the E-box (CANNTG) motif in the promoter of mouse 6PGDH is an important cis-regulatory element for ADD1/SREBP1c. 6PGDH mRNA is highly expressed in white adipose tissue and tightly modulated by nutritional status. Furthermore, we found that ADD1/SREBP1c mediates insulin-dependent 6PGDH expression and that PI3-kinase is an important linker for its regulation. Taken together, these data suggest that ADD1/SREBP1c is a key transcription factor for 6PGDH gene expression and would coordinate glucose metabolism and lipogenesis for energy homeostasis."
40,"CP. Busch, SB. Harris, AJ. Hanley, B. Zinman and RA. Hegele, ","""The ADD1 G460W polymorphism is not associated with variation in blood pressure in Canadian Oji-Cree."", ",Journal of human genetics ,44(4) ,(1999). ,10429360; ,,"Since adducin modulates cellular sodium retention, its follows that ADD1, which encodes the alpha-subunit of adducin, is an attractive candidate gene for blood pressure variation. Association studies examining the relationship between polymorphism at ADD1 codon 460 (G460W) and both hypertension and blood pressure, which were performed in a variety of human population samples derived from different genetic backgrounds, have given inconsistent results. We examined the association between the ADD1 G460W polymorphism and variation in blood pressure in a sample of non-diabetic, largely normotensive Canadian Oji-Cree from an isolated community in Northern Ontario. Among 481 Oji-Cree subjects, we measured blood pressure and related clinical phenotypes and determined genotypes of ADD1 G460W. We observed an allele frequency of 0.08 for the ADD1 W460 variant, which is among the lowest so far observed in human populations. We found significant associations between variation in both systolic and diastolic blood pressure and gender, age, body mass index (BMI), and treatment for hypertension. However, we found no association between the ADD1 W460 allele and increased blood pressure, nor did we observe a higher frequency of the W460 allele in a hypertensive subgroup compared with normotensive subjects. While the low sample frequency of ADD1 W460 is consistent with the low sample prevalence of hypertension, the absence of a specific association with both blood pressure and hypertension suggests that the ADD1 W460 variant is not an important determinant of blood pressure among individuals of this genetic background."
41,"M. Boizard, X. Le Liepvre, P. Lemarchand, F. Foufelle, P. Ferré and I. Dugail, ","""Obesity-related overexpression of fatty-acid synthase gene in adipose tissue involves sterol regulatory element-binding protein transcription factors."", ",The Journal of biological chemistry ,273(44) ,(Oct. 1998). ,9786926; ,,"Elevated lipogenesis is a key determinant of exaggerated fat deposition in adipose tissue of obese Zucker rats. We previously delineated a region in the fatty-acid synthase promoter, which was responsible for obesity-related overexpression of the fatty-acid synthase (FAS) gene, by negatively regulating the activity of the downstream promoter in lean but not obese rat fat cells. The present study aimed to identify the transcriptional factors acting on this target region. First, functional analysis of mutated FAS promoter constructs in transiently transfected lean and obese rat adipocytes showed that the activity of the obesity-related region relied on the presence of a transcriptionally inactive sterol regulatory element at -150, which counteracted activation through the downstream E-box. Adenovirus-mediated overexpression of a dominant negative form of adipocyte determination and differentiation factor 1 (ADD1) was used to neutralize endogenous ADD1/ sterol regulatory element-binding protein (SREBP) transcriptional activity in fat cells, by producing inactive dimers unable to bind target DNA. With this system, we observed that overexpression of FAS in obese rat adipocytes was ADD1/SREBP-dependent. SREBP isoforms expression was assessed in lean and obese rat fat cells and showed no differences in the level of ADD1/SREBP1 mRNA. In addition, equivalent amounts of immunoreactive ADD1/SREBP1 were found in nuclear extracts from lean and obese rat fat cells. In contrast, immunoreactive SREBP2, which was very low in nuclear extracts from lean rats, was induced in obese rat fat cells. Finally, using in vitro binding studies, we showed that SREBP2 was able to displace ADD1/SREBP1 binding from the sterol regulatory element (SRE) site. Thus, we propose a mechanism for obesity-related overexpression of FAS gene in rat adipocyte. ADD1/SREBP1-activated transcription proceeding from the E-box motif is counterbalanced by a negative SRE site acting by limiting the availability of ADD1/SREBP1 in normal fat cells. The negative effect of this site is abolished in obese rat adipocyte nuclei where SREBP2 is induced and can substitute for ADD1/SREBP1 binding to the inactive SRE. These results provide evidence for the implication of SREBPs in the dysregulation of adipocyte metabolism characteristic of the obese state."
42,"AR. Cieślewicz and A. Jabłecka, ","""Genetic base of heart diseases."", ",Polski merkuriusz lekarski : organ Polskiego Towarzystwa Lekarskiego ,29(169) ,(Jul. 2010). ,20712239; ,,"Progress in understanding of human genome enables the researches to reveal genetic basis of many disorders, including genetic heart diseases--defects developed by genetic disorders. The most frequent causes of genetic diseases are defects of many genes (e.g., a correlation has been observed between arterial hypertension and mutations in ACE and ADD1 genes). Moreover, a defect of single gene can be connected with several disorders (e.g., mutations in preseniline genes observed in Alzheimer disease and dilated cardiomyopathy). On the other hand, mutations in genes coding elements of particular signaling pathway can cause similar disorders (mutations in different components of RAS-MAPK pathway cause such disorders as Noonan syndrome, LEOPARD syndrome, Costello syndrome and CFC). The ability to identify genetic markers connected with heart diseases may contribute to the improvement of diagnostic and treatment of such disorders."
43,"X. Liang, Y. Zhou and S. Li, ","""Association of TBXA2R, P2Y12 and ADD1 genes polymorphisms with ischemic stroke susceptibility: A metaanalysis."", ",Clinical and investigative medicine. Medecine clinique et experimentale ,43(3) ,(Aug. 2020). ,32971583; ,DOI 10.25011/cim.v43i3.34597.,"Ischemic stroke is a common cause of death and disability throughout the world. We aimed to evaluate the association between polymorphisms in TBXA2R (rs4523, rs768963, rs1131882), P2Y12 (rs204693), ADD1 (rs4961) and risk of ischemic stroke."
44,"E. Gonzalez-Fernandez, L. Fan, S. Wang, Y. Liu, W. Gao, KN. Thomas, F. Fan and RJ. Roman, ","""The adducin saga: pleiotropic genomic targets for precision medicine in human hypertension-vascular, renal, and cognitive diseases."", ",Physiological genomics ,54(2) ,(Feb. 2022). ,34859687; ,DOI 10.1152/physiolgenomics.00119.2021.,"Hypertension is a leading risk factor for stroke, heart disease, chronic kidney disease, vascular cognitive impairment, and Alzheimer's disease. Previous genetic studies have nominated hundreds of genes linked to hypertension, and renal and cognitive diseases. Some have been advanced as candidate genes by showing that they can alter blood pressure or renal and cerebral vascular function in knockout animals; however, final validation of the causal variants and underlying mechanisms has remained elusive. This review chronicles 40 years of work, from the initial identification of adducin (ADD) as an ACTIN-binding protein suggested to increase blood pressure in Milan hypertensive rats, to the discovery of a mutation in ADD1 as a candidate gene for hypertension in rats that were subsequently linked to hypertension in man. More recently, a recessive K572Q mutation in ADD3 was identified in Fawn-Hooded Hypertensive (FHH) and Milan Normotensive (MNS) rats that develop renal disease, which is absent in resistant strains. ADD3 dimerizes with ADD1 to form functional ADD protein. The mutation in ADD3 disrupts a critical ACTIN-binding site necessary for its interactions with actin and spectrin to regulate the cytoskeleton. Studies using Add3 KO and transgenic strains, as well as a genetic complementation study in FHH and MNS rats, confirmed that the K572Q mutation in ADD3 plays a causal role in altering the myogenic response and autoregulation of renal and cerebral blood flow, resulting in increased susceptibility to hypertension-induced renal disease and cerebral vascular and cognitive dysfunction."
45,"Y. Sawada and M. Noda, ","""An adipogenic basic helix-loop-helix-leucine zipper type transcription factor (ADD1) mRNA is expressed and regulated by retinoic acid in osteoblastic cells."", ","Molecular endocrinology (Baltimore, Md.) ",10(10) ,(Oct. 1996). ,9121491; ,,"ADD1 is a recently identified basic helix-loop-helix leucine zipper-type transcription factor that acts as a positive regulator of adipocyte-specific gene expression. Since adipocytes may share their precursor with osteoblasts, we examined the expression of ADD1 mRNA in osteoblast-like cells. In osteoblastic MC3T3-E1 cells, the level of the ADD1 mRNA expression was low at the early period of cultures while it subsequently increased with time up to more than 10-fold in the later period of cultures along with the expression of alkaline phosphatase, a differentiation marker of these cells. In ROS17/2.8 cells, which represent mature osteoblasts, ADD1 mRNA was expressed constitutively. Treatment with retinoic acid (RA) enhanced the ADD1 mRNA expression several fold in these cells within 4 h in a dose-dependent manner. This RA effect on the ADD1 mRNA expression was blocked by dichloro-D-ribofuranosylbenzimidazole but not by cycloheximide. RA treatment did not affect the ADD1 mRNA stability, suggesting the involvement of transcriptional control. Electrophoretic mobility shift assay revealed that proteins in the crude nuclear extracts prepared from ROS17/2.8 cells were bound to the E box-containing ADD1 recognition DNA sequence, E/C, and that this binding activity was enhanced by the RA treatment. Neither the E2A protein recognition sequence nor the Myo-D/E12 recognition sequence competed against the E/C sequence for the binding, indicating the sequence specificity of the binding activity. Furthermore, RA treatment enhanced the transactivation activity of the chloramphenicol acetyltransferase construct containing the E/C sequence in the transient transfection assay in ROS17/2.8 cells. RA treatment also enhanced the ADD1 mRNA expression in another rat calvaria-derived cell line, RCT1, and in the primary cultures of newborn rat calvaria cells. Overexpression of ADD1 in ROS17/2.8 enhanced the level of the osteocalcin mRNA expression. These results indicated that the adipogenic basic helix-loop-helix leucine zipper-type transcription factor (ADD1) mRNA was expressed in osteoblastic cells and that its expression was associated with the expression of an osteoblastic phenotype-related gene."
46,"D. Lacasa, X. Le Liepvre, P. Ferre and I. Dugail, ","""Progesterone stimulates adipocyte determination and differentiation 1/sterol regulatory element-binding protein 1c gene expression. potential mechanism for the lipogenic effect of progesterone in adipose tissue."", ",The Journal of biological chemistry ,276(15) ,(Apr. 2001). ,11278421; ,,"Fatty acid synthase (FAS), a nutritionally regulated lipogenic enzyme, is transcriptionally controlled by ADD1/SREBP1c (adipocyte determination and differentiation 1/sterol regulatory element-binding protein 1c), through insulin-mediated stimulation of ADD1/SREBP1c expression. Progesterone exerts lipogenic effects on adipocytes, and FAS is highly induced in breast tumor cell lines upon progesterone treatment. We show here that progesterone up-regulates ADD1/SREBP1c expression in the MCF7 breast cancer cell line and the primary cultured preadipocyte from rat parametrial adipose tissue. In MCF7, progesterone induced ADD1/SREBP1c and Metallothionein II (a well known progesterone-regulated gene) mRNAs, with comparable potency. In preadipocytes, progesterone increased ADD1/SREBP1c mRNA dose-dependently, but not SREBP1a or SREBP2. Run-on experiments demonstrated that progesterone action on ADD1/SREBP1c was primarily at the transcriptional level. The membrane-bound and mature nuclear forms of ADD1/SREBP1 protein accumulated in preadipocytes cultured with progesterone, and FAS induction could be abolished by adenovirus-mediated overexpression of a dominant negative form of ADD1/SREBP1 in these cells. Finally, in the presence of insulin, progesterone was unable to up-regulate ADD1/SREBP1c mRNA in preadipocytes, whereas its effect was restored after 24 h of insulin deprivation. Together these results demonstrate that ADD1/SREBP1c is controlled by progesterone, which, like insulin, acts by increasing ADD1/SREBP1c gene transcription. This provides a potential mechanism for the lipogenic actions of progesterone on adipose tissue."
