,authors,ArticleTitle,journal_title,volume,date,pubmed,doi_pii_str,abstract
0,"YZ. Huang, LN. Qian, J. Wang, CL. Zhang, XT. Fang, CZ. Lei, XY. Lan, Y. Ma, YY. Bai, FP. Lin and H. Chen, ","""Genetic Variants in ADD1 Gene and their Associations with Growth Traits in Cattle."", ",Animal biotechnology ,30(1) ,(Jan. 2019). ,29527980; ,DOI 10.1080/10495398.2017.1398754.,"The α-adducin (ADD1) is a subunit of adducin which is a cytoskeleton heterodimeric protein. Adducin participates in oocytes chromosome meiosis of mice, prompting adducin has an effect on embryonic development. Adducin gene mutation has significantly functional change. So the present study was to identify and characterize polymorphisms within the coding region of the bovine ADD1 gene among different cattle breeds. Here, 11 novel single nucleotide polymorphisms (SNPs 1-11) were identified by DNA sequencing and polymerase chain reaction-single stranded conformational polymorphism, there were one synonymous mutation in exon 1 (SNP1); four missense mutations in exons 4, 7, and 8 (SNPs 3-6); and six mutations in introns 4, 12, 13, and 14 (SNPs 2, 7-10). The statistical analyses indicated that the some SNPs are associated with the growth traits (body length, body height, chest circumference, and hucklebone width) in Chinese Jiaxian cattle population. Our results provide evidence that polymorphisms in the ADD1 gene are associated with growth traits, and may be used for marker-assisted selection in beef cattle breeding program."
1,"J. Kalita, UK. Misra, B. Kumar, BI. Somarajan, S. Kumar and B. Mittal, ","""ACE and ADD1 gene in extra and intracranial atherosclerosis in ischaemic stroke."", ",Neurological research ,35(4) ,(May. 2013). ,23540412; ,DOI 10.1179/1743132813Y.0000000161.,"Hypertension is closely linked to ischaemic stroke (IS) and atherosclerosis, but there are no studies correlating the candidate hypertensive gene, namely angiotensin converting enzyme (ACE) and adducin 1 (ADD1) with magnetic resonance angiographic (MRA) abnormality, therefore this study was undertaken."
2,"S. Gupta, V. Jhawat, BK. Agarwal, P. Roy and V. Saini, ","""Alpha Adducin (ADD1) Gene Polymorphism and New Onset of Diabetes Under the Influence of Selective Antihypertensive Therapy in Essential Hypertension."", ",Current hypertension reviews ,15(2) ,(2019). ,30062972; ,DOI 10.2174/1573402114666180731111453.,"Different antihypertensive therapies (especially diuretics) are reported to induce the new onset of diabetes in some hypertensive patients. α-adducin-1 (ADD1) gene is salt sensitive gene which has its role in etiology of hypertension via salt sensitivity. Therefore, the G460T polymorphism of ADD1 gene may be associated with new onset of diabetes under the influence of diuretic and other antihypertensive therapies."
3,"LN. Zhang, PP. Liu, L. Wang, F. Yuan, L. Xu, Y. Xin, LJ. Fei, QL. Zhong, Y. Huang, L. Xu, LM. Hao, XJ. Qiu, Y. Le, M. Ye and S. Duan, ","""Lower ADD1 gene promoter DNA methylation increases the risk of essential hypertension."", ",PloS one ,8(5) ,(2013). ,23691048; ,DOI 10.1371/journal.pone.0063455.,"The goal of our study is to investigate the contribution of promoter DNA methylation of α-adducin (ADD1) gene to the risk of essential hypertension (EH). Using the bisulphite pyrosequencing technology, DNA methylation levels of five CpG dinucleotides on ADD1 promoter were measured among 33 EH cases and 28 healthy controls. Significantly higher ADD1 DNA methylation levels were observed in the females than in the males (CpG1: P = 0.016; CpG2-5: P = 0.021). A breakdown analysis by gender showed that lower CpG1 methylation was associated with an increased risk of EH in females (adjusted P = 0.042). A much more significant association between lower CpG2-5 methylation levels and the increased risk of EH was found in males (adjusted P = 0.008). CpG1 methylation was inversely correlated with age in females (r = -0.407, P = 0.019) but not in males. ADD1 CpG1 and CpG2-5 methylation levels were significantly lower in post-menopausal (>50 years) women than pre-menopausal (≤50 years) women (CpG1: P = 0.006; CpG2-5: P = 0.034). A significant interaction between CpG1 methylation and age was found in females (CpG1*age: P = 0.029). CpG2-5 methylation was shown as a significant predictor of EH in males [area under curve (AUC) = 0.855, P = 0.001], in contrast that CpG1 methylation was a trend toward indicator in females (AUC = 0.699, P = 0.054). In addition, significant differences were observed between males and females for alanine aminotransferase (ALT, P = 0.001), aspartate aminotransferase (AST, P = 0.005) and uric acid (P<0.001). The concentration of AST was inversely correlated with ADD1 CpG2-5 methylation levels in female controls (r = -0.644, P = 0.024). These observations may bring new hints to elaborate the pathogenesis of EH."
4,"X. Liao, W. Wang, Z. Zeng, Z. Yang, H. Dai and Y. Lei, ","""Association of alpha-ADD1 Gene and Hypertension Risk: A Meta-Analysis."", ",Medical science monitor : international medical journal of experimental and clinical research ,21 ,(Jun. 2015). ,26042478; ,DOI 10.12659/MSM.893191.,"Results regarding the association between a-adducin (ADD1) gene and essential hypertension (EH) risk remain inconsistent. Therefore, we performed this meta-analysis to investigate this association."
5,"AC. Sousa, R. Palma Dos Reis, A. Pereira, S. Borges, AI. Freitas, G. Guerra, T. Góis, M. Rodrigues, E. Henriques, S. Freitas, I. Ornelas, D. Pereira, A. Brehm and MI. Mendonça, ","""Relationship between ADD1 Gly460Trp gene polymorphism and essential hypertension in Madeira Island."", ",Medicine ,96(42) ,(Oct. 2017). ,29049185; ,DOI 10.1097/MD.0000000000007861.,"Essential hypertension (EH) is a complex disease in which physiological, environmental, and genetic factors are involved in its genesis. The genetic variant of the alpha-adducin gene (ADD1) has been described as a risk factor for EH, but with controversial results.The objective of this study was to evaluate the association of ADD1 (Gly460Trp) gene polymorphism with the EH risk in a population from Madeira Island.A case-control study with 1614 individuals of Caucasian origin was performed, including 817 individuals with EH and 797 controls. Cases and controls were matched for sex and age, by frequency-matching method. All participants collected blood for biochemical and genotypic analysis for the Gly460Trp polymorphism. We further investigated which variables were independently associated to EH, and, consequently, analyzed their interactions.In our study, we found a significant association between the ADD1 gene polymorphism and EH (odds ratio 2.484, P = .01). This association remained statistically significant after the multivariate analysis (odds ratio 2.548, P = .02).The ADD1 Gly460Trp gene polymorphism is significantly and independently associated with EH risk in our population. The knowledge of genetic polymorphisms associated with EH is of paramount importance because it leads to a better understanding of the etiology and pathophysiology of this pathology."
6,"S. Yermolenko, Y. Chumachenko, V. Orlovskyi, I. Moiseyenko and O. Orlovskyi, ","""The Association between Gly460Trp-Polymorphism of Alpha-Adducin 1 Gene (ADD1) and Arterial Hypertension Development in Ukrainian Population."", ",International journal of hypertension ,2021 ,(2021). ,34055401; ,DOI 10.1155/2021/5596974.,"Arterial hypertension (AH) belongs to the diseases with genetic predisposition that determines the necessity of research on the genetic component's influence on this disease development. It is suggested that one of the salt-sensitive arterial hypertension potential markers may be the alpha-adducin gene because its protein product is involved in the ion transport regulation in the renal epithelium. Thus, the aim of the study was to investigate the association between ADD1 Gly460Trp-polymorphism and the AH development risk among patients with different risk factors in the Ukrainian population. The study included 232 Ukrainians: 120 patients with diagnosed arterial hypertension and 112 practically healthy individuals. Polymerase chain reaction-restriction fragment length polymorphism (PCR-RFLP) analysis was used for ADD1 Gly460Trp-polymorphism genotyping. The ADD1 Gly460Trp-polymorphic locus is an important predictor of arterial hypertension development in the Ukrainian population, but other nongenetic factors should be considered in further studies."
7,"G. Tripodi, M. Florio, M. Ferrandi, R. Modica, H. Zimdahl, N. Hubner, P. Ferrari and G. Bianchi, ","""Effect of Add1 gene transfer on blood pressure in reciprocal congenic strains of Milan rats."", ",Biochemical and biophysical research communications ,324(2) ,(Nov. 2004). ,15474463; ,,"Genetic variants of alpha adducin (ADD1) taken alone or in interaction with those of beta (ADD2) and gamma (ADD3) subunits have been associated with primary hypertension in humans and in Milan hypertensive (MHS) rats. In this study, we report the dissection of the individual contribution of each rat Add gene to blood pressure, by congenic substitution mapping. Congenic strains were developed by introgressing Add1, Add2, and Add3 genes (and chr14, chr4, and chr1 associated segments) of MHS in the Milan normotensive rat (MNS) genetic background (MNS.H-Add1, MNS.H-Add2, and MNS.H-Add3) and vice versa (MHS.N-Add1, MHS.N-Add2, and MHS.N-Add3). Systolic blood pressure (SBP) of MNS.H-Add1 rats was significantly higher (+10 mmHg) than that of MNS, whereas SBP of MHS.N-Add1 was significantly lower (-10 mmHg) than that of MHS. The differences account for 43% of the blood pressure differences between MHS and MNS. In contrast, SBPs of Add2 and Add3 congenic strains were not different from those of the correspondent recipient parental strain. The fine mapping of chr14 congenic segment supports the identity of blood pressure QTL with Add1 gene."
8,"P. Ramu, G. Umamaheswaran, DG. Shewade, RP. Swaminathan, J. Balachander and C. Adithan, ","""Gly460Trp polymorphism of the ADD1 gene and essential hypertension in an Indian population: A meta-analysis on hypertension risk."", ",Indian journal of human genetics ,16(1) ,(Jan. 2010). ,20838486; ,DOI 10.4103/0971-6866.64938.,"Essential hypertension is a complex genetic trait. Genetic variant of alpha adducin (ADD1) gene have been implicated as a risk factor for hypertension. Given its clinical significance, we investigated the association between ADD1 Gly460Trp gene polymorphism and essential hypertension in an Indian population. Further, a meta-analysis was carried out to estimate the risk of hypertension."
9,"M. Foretz, C. Pacot, I. Dugail, P. Lemarchand, C. Guichard, X. Le Lièpvre, C. Berthelier-Lubrano, B. Spiegelman, JB. Kim, P. Ferré and F. Foufelle, ","""ADD1/SREBP-1c is required in the activation of hepatic lipogenic gene expression by glucose."", ",Molecular and cellular biology ,19(5) ,(May. 1999). ,10207099; ,,"The transcription of genes encoding proteins involved in the hepatic synthesis of lipids from glucose is strongly stimulated by carbohydrate feeding. It is now well established that in the liver, glucose is the main activator of the expression of this group of genes, with insulin having only a permissive role. While ADD1/SREBP-1 has been implicated in lipogenic gene expression through temporal association with food intake and ectopic gain-of-function experiments, no genetic evidence for a requirement for this factor in glucose-mediated gene expression has been established. We show here that the transcription of ADD1/SREBP-1c in primary cultures of hepatocytes is controlled positively by insulin and negatively by glucagon and cyclic AMP, establishing a link between this transcription factor and carbohydrate availability. Using adenovirus-mediated transfection of a powerful dominant negative form of ADD1/SREBP-1c in rat hepatocytes, we demonstrate that this factor is absolutely necessary for the stimulation by glucose of L-pyruvate kinase, fatty acid synthase, S14, and acetyl coenzyme A carboxylase gene expression. These results demonstrate that ADD1/SREBP-1c plays a crucial role in mediating the expression of lipogenic genes induced by glucose and insulin."
10,"A. Kundu and A. Anand, ","""Computational study of ADD1 gene polymorphism associated with hypertension."", ",Cell biochemistry and biophysics ,65(1) ,(Jan. 2013). ,22810272; ,DOI 10.1007/s12013-012-9398-2.,"We have determined the non-synonymous single-nucleotide polymorphisms (nsSNPs) of α adducin 1 (ADD1) gene and its variations in different populations to understand its role in hypertension. Out of 1,113 SNPs, 9 are found to be non-synonymous, of which 7 showed significant damaging effect and one of them showed SNP variability with large differences among the minor allele frequency observed in various populations. The amino acid change found for rs4961 is from glycine to tryptophan, i.e., from an alkyl amino acid to an aromatic amino acid. This residual change is observed in the coiled region of the protein and is also predicted to be disordered by computational algorithm. Protein disorder plays an important role in structural and functional genomics. Hence, because of the complete change in side chains of the amino acid residues occurring in the coiled and disordered region of the protein, the structure of the protein might be altered and the function might be affected, leading to the risk for hypertension."
11,"JB. Kim and BM. Spiegelman, ","""ADD1/SREBP1 promotes adipocyte differentiation and gene expression linked to fatty acid metabolism."", ",Genes & development ,10(9) ,(May. 1996). ,8654925; ,,"Adipocyte determination and differentiation-dependent factor 1 (ADD1) is a member of the basic helix-loop-helix leucine zipper (bHLH-LZ) family of transcription factors that binds to two distinct DNA sequences and has been associated with both adipocyte development and cholesterol homeostasis (where it has been termed SREBP1). To investigate the biological role of ADD1, we expressed wild-type and dominant negative forms of this protein with retroviral vectors in preadipocytes and nonadipogenic cells. A dominant-negative form of ADD1 with a point mutation in the DNA-binding domain sharply represses the differentiation of 3T3-L1 cells as observed morphologically or by the expression of adipocyte-specific mRNAs. When NIH-3T3 cells ectopically expressing ADD1 are cultured under hormonal conditions not favoring differentiation, they do not overtly differentiate but still activate expression of mRNAs for fatty acid synthase (FAS) and lipoprotein lipase (LPL), two key genes that regulate fatty acid metabolism. Under culture conditions permissive for differentiation including a PPAR activator, 15%-20% of the cells expressing ADD1 undergo adipogenesis while 2%-3% of cells containing a control vector differentiate. Simultaneous expression of ADD1 with PPARgamma increases the transcriptional activity of this adipogenic nuclear hormone receptor, suggesting involvement of ADD1 in this pathway. These data indicate that ADD1 plays an important role in fat cell gene expression and differentiation, and suggest that it may function by augmenting a step in PPARgamma-mediated transcription."
12,"YS. Lee, DH. Sohn, D. Han, HW. Lee, RH. Seong and JB. Kim, ","""Chromatin remodeling complex interacts with ADD1/SREBP1c to mediate insulin-dependent regulation of gene expression."", ",Molecular and cellular biology ,27(2) ,(Jan. 2007). ,17074803; ,,"Insulin plays a critical role in whole-body energy homeostasis by regulating lipid and glucose metabolism. In fat and liver tissues, ADD1/SREBP1c is a key transcription factor to mediate insulin-dependent regulation of gene expression. Although transcriptional and proteolytic activation of ADD1/SREBP1c has been studied intensively, the mechanism by which insulin regulates expression of its target genes with ADD1/SREBP1c at the chromatin level is unclear. Here, we reveal that SWI/SNF chromatin remodeling factors interact with the ADD1/SREBP1c and actively regulate insulin-dependent gene expression. Insulin enhanced recruitment of SWI/SNF chromatin remodeling factors to its target gene promoters with concomitant changes in the chromatin structures as well as gene expression. Furthermore, in vivo overexpression of BAF155/SRG3, a component of the SWI/SNF complex, substantially promoted insulin target gene expression and insulin sensitivity. Taken together, our results suggest that the SWI/SNF chromatin remodeling complexes confer not only insulin-dependent gene expression but also insulin sensitivity in vivo via interaction with ADD1/SREBP1c."
13,"J. Kotzka, D. Müller-Wieland, A. Koponen, D. Njamen, L. Kremer, G. Roth, M. Munck, B. Knebel and W. Krone, ","""ADD1/SREBP-1c mediates insulin-induced gene expression linked to the MAP kinase pathway."", ",Biochemical and biophysical research communications ,249(2) ,(Aug. 1998). ,9712704; ,,"The aim of this study was to define the role of sterol regulatory element binding protein (SREBP)-1c, the human homologue to ADD1 (adipocyte determination- and differentiation-dependent factor 1), in insulin-induced gene expression. Transfection studies using SREBP-1-deficient cells and a LDL receptor promoter fragment containing the ADD1/SREBP-1c binding side showed that the effects of insulin and PDGF were abolished compared to control cells and completely reconstituted by overexpressing ADD1/SREBP-1c. Overexpression of upstream activators of MAP kinases, like MEKK1 or MEK1, demonstrated that ADD1/SREBP-1c-mediated effects of insulin and PDGF might be linked to the MAP kinase cascade. The recombinant N-terminal domain of ADD1/SREBP-1c was phosphorylated predominantly on serine and slightly on threonine residues by MAP kinases ERK1 and ERK2 in vitro. This was reversible by alkaline phosphatase. We conclude that ADD1/SREBP-1c mediates gene regulatory effects of insulin as well as PDGF and that this signalling is linked to the MAP kinase cascade."
14,"YZ. Huang, EP. Zhang, J. Wang, YT. Huai, L. Ma, FY. Chen, XY. Lan, CZ. Lei, XT. Fang, JQ. Wang and H. Chen, ","""A large indel mutation of the bovine ADD1/SREBP1c gene and its effects on growth traits in some native cattle breeds from China."", ",Molecular biology reports ,38(3) ,(Mar. 2011). ,20872252; ,DOI 10.1007/s11033-010-0327-4.,"Adipocyte determination and differentiation-dependent factor 1/sterol regulatory element-binding protein-1c (ADD1/SREBP1c) is a major determinant of tissue differential lipogenic capacity in mammalian and avian species. The objectives of the present study were to focus on insertion-deletion polymorphism (indel) in the bovine ADD1/SREBP1c gene, and analyzing its effect on growth traits in a sample of 1035 cattle belonging to four Chinese cattle breeds. PCR-SSCP, DNA sequencing and agarose electrophoresis methods were used. The 778 bp PCR products of ADD1/SREBP1c gene exhibited three genotypes and two alleles were revealed: W and D. Frequencies of the W allele varied from 0.8651 to 1.000. The associations of the 84 bp indel mutation of ADD1/SREBP1c gene with growth traits of 265 Nanyang cows were analyzed. The animals with genotype WD had significantly higher birth weight, body weight, average daily gain than those with genotype WW at birth, 6-, 12-, 18-, and 24-month old (P < 0.05 or P < 0.01). These results suggest that the indel mutation of bovine ADD1/SREBP1c gene may influence the growth traits in cattle."
15,"Y. Zhang, P. Chang and Z. Liu, ","""ADD1 Single Nucleotide Polymorphisms Are Associated With Essential Hypertension Among Han and Mongolian Population in Inner Mongolia Area."", ",Frontiers in genetics ,13 ,(2022). ,36035164; ,DOI 10.3389/fgene.2022.931803.,"Aldosterone synthase (CYP11B2) and α-adducing (ADD1) are candidate genes that play key roles during essential hypertension (EH) incidence. However, the association between their genetic mutations and the risk of EH is unclear. The present study investigated specific single nucleotide polymorphisms (SNPs) from CYP11B2 and ADD1, and their potential role as risk factors for EH based on 423 Mongolian and 410 Han people in Inner Mongolia province. In the allelic model, people with ADD1 rs2239728-A presented a 0.74-fold risk than rs2239728-C, whereas the ADD1 rs4961-T was associated with a 1.37-fold higher risk than allele G in the Han population. The genetic model reported that the rs2239728-A carrier (AA + AC) was 0.59-fold lower than the CC carrier, whereas the rs4961-G carrier (GG + GT) was 0.59-fold lower than the TT carrier in the dominant model. After gender adjustment, people with rs2239728-A was a 0.63-fold risk than -C in EH, but the rs4961-T carrier was associated with a 1.63-times higher risk than -G in females. Haplotype analysis showed that GCCT was associated with essential hypertension in the Han population, and it was a risk factor for EH. Our identification reported novel SNPs of ADD1 with protective significance for EH among females in the Chinese Han population, together with its haplotype GCCT as a risk factor for EH."
16,"L. Han, P. Liu, C. Wang, Q. Zhong, R. Fan, L. Wang, S. Duan and L. Zhang, ","""The interactions between alcohol consumption and DNA methylation of the ADD1 gene promoter modulate essential hypertension susceptibility in a population-based, case-control study."", ",Hypertension research : official journal of the Japanese Society of Hypertension ,38(4) ,(Apr. 2015). ,25567773; ,DOI 10.1038/hr.2014.172.,"The potential effects of the interactions between DNA methylation (CpG1 and CpG2-5 methylation levels) of the α-adducin (ADD1) gene promoter and ADD1 tagSNPs (tag single-nucleotide polymorphisms) or the environmental factors on essential hypertension (EH) risk have not been clarified. Thus, we performed an age- and gender-matched case-control study to investigate the association between ADD1 tagSNPs and EH. A total of 1020 subjects with EH and 1020 normotensive subjects were genotyped by melting temperature shift technology. Logistic regression was used to assess the associations of ADD1 tagSNPs, environmental factors and EH. The generalized multifactor dimensionality reduction (GMDR) method was applied to explore the potential interactions. Under additive, dominant and recessive models, no significant associations were evidenced between EH and rs3755885, rs2071694, rs4963 or rs3775067 with the complete data set or the gender-stratified analysis after adjusting for triglycerides, body mass index and alcohol consumption. However, we observed a significant association between rs4961 and EH under the dominant model after Bonferroni correction when adjusting for confounding factors in the entire sample (odds ratio (OR)=0.64, 95% confidence interval (CI)=0.50-0.83, P=0.001). In GMDR, the two-factor interaction model of alcohol consumption and DNA methylation (CpG1 methylation) was the best model, with a maximum cross-validation consistency of 9/10 and testing balance accuracy of 0.63 (P=0.01). Our results indicate that the SNP rs4961 has a protective role in the development of EH. In conclusion, the interactions between alcohol consumption and DNA methylation (CpG1 methylation) of the ADD1 gene promoter have a significant role in modifying EH susceptibility."
17,"J. Nasir, B. Lin, M. Bucan, T. Koizumi, JH. Nadeau and MR. Hayden, ","""The murine homologues of the Huntington disease gene (Hdh) and the alpha-adducin gene (Add1) map to mouse chromosome 5 within a region of conserved synteny with human chromosome 4p16.3."", ",Genomics ,22(1) ,(Jul. 1994). ,7959767; ,,"Huntington disease (HD) is a severe autosomal dominant neurodegenerative disorder associated with a novel gene (IT15). Recently, we reported the cloning of Hdh, the murine homologue of IT15. Here, using an interspecific backcross, we have mapped both Hdh and the mouse homologue of human alpha-adducin (Add1), a membrane-associated cytoskeletal protein gene. Both of these genes map in the same position on mouse chromosome 5 in a region associated with ancestral chromosomal rearrangements and show no recombination with D5H4S43, D5H4S115, and D5H4S62, the murine homologues of D4S43, D4S115, and D4S62, respectively. Further mapping studies of humans, mice, and other mammalian species should reveal the nature of the rearrangements affecting this chromosomal segment during mammalian evolution."
